{
  "$id": "https://w3id.org/traceability/schemas/MillTestReportCertificate.json",
  "$schema": "http://json-schema.org/draft-07/schema#",
  "$comment": "{\"term\": \"MillTestReportCertificate\", \"@id\": \"https://w3id.org/traceability#MillTestReportCertificate\"}",
  "title": "Mill Test Report Certificate",
  "description": "Certifications made by a manufacturer of a metal product.",
  "type": "object",
  "properties": {
    "@context": {
      "type": "array",
      "const": [
        "https://www.w3.org/2018/credentials/v1",
        "https://w3id.org/traceability/v1"
      ]
    },
    "type": {
      "type": "array",
      "const": ["VerifiableCredential", "MillTestReportCertificate"]
    },
    "id": {
      "type": "string"
    },
    "name": {
      "type": "string"
    },
    "description": {
      "type": "string"
    },
    "issuanceDate": {
      "type": "string"
    },
    "issuer": {
      "type": "object"
    },
    "credentialSubject": {
      "type": "object"
    },
    "proof": {
      "type": "object"
    },
    "relatedLink": {
      "title": "Related Link",
      "description": "Links related to this verifiable credential",
      "type": "array",
      "items": {
        "$ref": "https://w3id.org/traceability/schemas/LinkRole.json"
      }
    }
  },
  "additionalProperties": false,
  "required": [],
  "examples": []
}
